{
  "schema": "streamlined-gantt/1",
  "defaultCalendar": "ew",
  "calendars": [
    {
      "id": "ew",
      "name": "Mon-Fri, England and Wales bank holidays",
      "workWeek": [1, 2, 3, 4, 5],
      "nonWorking": [
        {
          "date": "2026-01-01",
          "name": "New Year’s Day",
          "kind": "bank-holiday"
        },
        {
          "date": "2026-04-03",
          "name": "Good Friday",
          "kind": "bank-holiday"
        },
        {
          "date": "2026-04-06",
          "name": "Easter Monday",
          "kind": "bank-holiday"
        },
        {
          "date": "2026-05-04",
          "name": "Early May bank holiday",
          "kind": "bank-holiday"
        },
        {
          "date": "2026-05-25",
          "name": "Spring bank holiday",
          "kind": "bank-holiday"
        },
        {
          "date": "2026-08-31",
          "name": "Summer bank holiday",
          "kind": "bank-holiday"
        },
        {
          "date": "2026-12-25",
          "name": "Christmas Day",
          "kind": "bank-holiday"
        },
        {
          "date": "2026-12-28",
          "name": "Boxing Day",
          "kind": "bank-holiday"
        },
        {
          "date": "2027-01-01",
          "name": "New Year’s Day",
          "kind": "bank-holiday"
        },
        {
          "date": "2027-03-26",
          "name": "Good Friday",
          "kind": "bank-holiday"
        },
        {
          "date": "2027-03-29",
          "name": "Easter Monday",
          "kind": "bank-holiday"
        },
        {
          "date": "2027-05-03",
          "name": "Early May bank holiday",
          "kind": "bank-holiday"
        },
        {
          "date": "2027-05-31",
          "name": "Spring bank holiday",
          "kind": "bank-holiday"
        },
        {
          "date": "2027-08-30",
          "name": "Summer bank holiday",
          "kind": "bank-holiday"
        },
        {
          "date": "2027-12-27",
          "name": "Christmas Day",
          "kind": "bank-holiday"
        },
        {
          "date": "2027-12-28",
          "name": "Boxing Day",
          "kind": "bank-holiday"
        }
      ]
    }
  ],
  "tasks": [
    {
      "id": "A",
      "name": "Task A",
      "start": "2026-11-02",
      "duration": 4
    },
    {
      "id": "B",
      "name": "Task B",
      "start": "2026-11-02",
      "duration": 3
    },
    {
      "id": "C",
      "name": "Task C",
      "start": "2026-11-02",
      "duration": 5
    },
    {
      "id": "D",
      "name": "Task D",
      "start": "2026-11-02",
      "duration": 2
    },
    {
      "id": "E",
      "name": "Task E",
      "start": "2026-11-02",
      "duration": 3
    },
    {
      "id": "F",
      "name": "Task F",
      "start": "2026-11-02",
      "duration": 1
    }
  ],
  "links": [
    {
      "id": "l1",
      "from": "A",
      "to": "B",
      "type": "FS",
      "lag": 0
    },
    {
      "id": "l2",
      "from": "A",
      "to": "C",
      "type": "SS",
      "lag": 2
    },
    {
      "id": "l3",
      "from": "B",
      "to": "D",
      "type": "FF",
      "lag": 1
    },
    {
      "id": "l4",
      "from": "C",
      "to": "E",
      "type": "FS",
      "lag": -1
    },
    {
      "id": "l5",
      "from": "D",
      "to": "F",
      "type": "FS",
      "lag": 0
    },
    {
      "id": "l6",
      "from": "E",
      "to": "F",
      "type": "FS",
      "lag": 0
    },
    {
      "id": "l7",
      "from": "A",
      "to": "E",
      "type": "SF",
      "lag": 3
    }
  ],
  "name": "CPM N2: mixed link types and lags"
}
